-- AddressBook Service
===========================================================
-- UC1 Ability to create a Address Book Service DataBase
===========================================================

mysql> create database addressbookservice;
Query OK, 1 row affected (0.01 sec)

mysql> show databases;
+--------------------+
| Database           |
+--------------------+
| addressbookservice |
| bridgelabz         |
| employee           |
| information_schema |
| mysql              |
| payroll_service    |
| performance_schema |
| sys                |
+--------------------+
8 rows in set (0.00 sec)

mysql> use addressbookservice;
Database changed

===========================================================
-- UC2  Creating table as AddressBook with attributes
===========================================================
mysql> create table AddressBook ( firstName varchar(50) not null,
    -> lastName varchar(50) not null,
    -> address varchar(100) not null,
    -> city varchar(50) not null,
    -> state varchar(50) not null,
    -> zip int not null,
    -> phoneNumber double not null,
    -> email varchar(100) not null );
Query OK, 0 rows affected (0.03 sec)

mysql> desc AddressBook;
+-------------+--------------+------+-----+---------+-------+
| Field       | Type         | Null | Key | Default | Extra |
+-------------+--------------+------+-----+---------+-------+
| firstName   | varchar(50)  | NO   |     | NULL    |       |
| lastName    | varchar(50)  | NO   |     | NULL    |       |
| address     | varchar(100) | NO   |     | NULL    |       |
| city        | varchar(50)  | NO   |     | NULL    |       |
| state       | varchar(50)  | NO   |     | NULL    |       |
| zip         | int          | NO   |     | NULL    |       |
| phoneNumber | double       | NO   |     | NULL    |       |
| email       | varchar(100) | NO   |     | NULL    |       |
+-------------+--------------+------+-----+---------+-------+
8 rows in set (0.00 sec)

===========================================================
-- UC3  Inserting new contacts to addressbook table
===========================================================
mysql> insert into AddressBook (firstname, lastname, address,city, state, zip,phoneNumber,email) values
    -> ('Pallavi', 'Chedge','Lakewood','Nagpur','Maharashtra', 346789, 8970065743,'pc@gmail.com'),
    -> ('Rashmi', 'Agrawal','Iriscourt','Mumbai','Maharashtra', 804198, 9805643789,'rashmi@gmail.com'),
    -> ('Rahul', 'Punewar','NovaApartment','Chennai','TamilNadu', 678907, 7777856749,'rp@gmail.com'),
    -> ('Shashwat', 'Patel','DattaApartment','Pune','Maharashtra', 341009, 9880565434,'sp@gmail.com');
Query OK, 4 rows affected (0.01 sec)
Records: 4  Duplicates: 0  Warnings: 0

mysql> select * from AddressBook;
+-----------+----------+----------------+---------+-------------+--------+-------------+------------------+
| firstName | lastName | address        | city    | state       | zip    | phoneNumber | email            |
+-----------+----------+----------------+---------+-------------+--------+-------------+------------------+
| Pallavi   | Chedge   | Lakewood       | Nagpur  | Maharashtra | 346789 |  8970065743 | pc@gmail.com     |
| Rashmi    | Agrawal  | Iriscourt      | Mumbai  | Maharashtra | 804198 |  9805643789 | rashmi@gmail.com |
| Rahul     | Punewar  | NovaApartment  | Chennai | TamilNadu   | 678907 |  7777856749 | rp@gmail.com     |
| Shashwat  | Patel    | DattaApartment | Pune    | Maharashtra | 341009 |  9880565434 | sp@gmail.com     |
+-----------+----------+----------------+---------+-------------+--------+-------------+------------------+
4 rows in set (0.00 sec)

===========================================================
-- UC4  Editing existing contact by person's first name
===========================================================
mysql> update AddressBook set  lastName='Agrawal' where firstname='Shashwat';
Query OK, 1 row affected (0.01 sec)
Rows matched: 1  Changed: 1  Warnings: 0

mysql> select * from AddressBook;
+-----------+----------+----------------+---------+-------------+--------+-------------+------------------+
| firstName | lastName | address        | city    | state       | zip    | phoneNumber | email            |
+-----------+----------+----------------+---------+-------------+--------+-------------+------------------+
| Pallavi   | Chedge   | Lakewood       | Nagpur  | Maharashtra | 346789 |  8970065743 | pc@gmail.com     |
| Rashmi    | Agrawal  | Iriscourt      | Mumbai  | Maharashtra | 804198 |  9805643789 | rashmi@gmail.com |
| Rahul     | Punewar  | NovaApartment  | Chennai | TamilNadu   | 678907 |  7777856749 | rp@gmail.com     |
| Shashwat  | Agrawal  | DattaApartment | Pune    | Maharashtra | 341009 |  9880565434 | sp@gmail.com     |
+-----------+----------+----------------+---------+-------------+--------+-------------+------------------+
4 rows in set (0.00 sec)

mysql> update addressbook set phoneNumber=7890065432 where firstname='Rahul';
Query OK, 1 row affected (0.01 sec)
Rows matched: 1  Changed: 1  Warnings: 0

mysql> select * from AddressBook;
+-----------+----------+----------------+---------+-------------+--------+-------------+------------------+
| firstName | lastName | address        | city    | state       | zip    | phoneNumber | email            |
+-----------+----------+----------------+---------+-------------+--------+-------------+------------------+
| Pallavi   | Chedge   | Lakewood       | Nagpur  | Maharashtra | 346789 |  8970065743 | pc@gmail.com     |
| Rashmi    | Agrawal  | Iriscourt      | Mumbai  | Maharashtra | 804198 |  9805643789 | rashmi@gmail.com |
| Rahul     | Punewar  | NovaApartment  | Chennai | TamilNadu   | 678907 |  7890065432 | rp@gmail.com     |
| Shashwat  | Agrawal  | DattaApartment | Pune    | Maharashtra | 341009 |  9880565434 | sp@gmail.com     |
+-----------+----------+----------------+---------+-------------+--------+-------------+------------------+
4 rows in set (0.00 sec)

===========================================================
-- UC5  Delete contact by using person's name
===========================================================
mysql> delete from addressBook where lastName='Chedge';
Query OK, 1 row affected (0.01 sec)

mysql> select * from AddressBook;
+-----------+----------+----------------+---------+-------------+--------+-------------+------------------+
| firstName | lastName | address        | city    | state       | zip    | phoneNumber | email            |
+-----------+----------+----------------+---------+-------------+--------+-------------+------------------+
| Rashmi    | Agrawal  | Iriscourt      | Mumbai  | Maharashtra | 804198 |  9805643789 | rashmi@gmail.com |
| Rahul     | Punewar  | NovaApartment  | Chennai | TamilNadu   | 678907 |  7890065432 | rp@gmail.com     |
| Shashwat  | Agrawal  | DattaApartment | Pune    | Maharashtra | 341009 |  9880565434 | sp@gmail.com     |
+-----------+----------+----------------+---------+-------------+--------+-------------+------------------+
3 rows in set (0.00 sec)

===========================================================
-- UC6 Retrieving the contact by city or state from addressbook
===========================================================

mysql> select * from AddressBook where city = 'Chennai' or State='TamilNadu';
+-----------+----------+---------------+---------+-----------+--------+-------------+--------------+
| firstName | lastName | address       | city    | state     | zip    | phoneNumber | email        |
+-----------+----------+---------------+---------+-----------+--------+-------------+--------------+
| Rahul     | Punewar  | NovaApartment | Chennai | TamilNadu | 678907 |  7890065432 | rp@gmail.com |
+-----------+----------+---------------+---------+-----------+--------+-------------+--------------+
1 row in set (0.00 sec)

===================================================================================
-- UC7 Understanding the size of addressbook by city and state - Here size indicates the count
===================================================================================

mysql> select count(firstname) from AddressBook where city = 'Mumbai';
+------------------+
| count(firstname) |
+------------------+
|                1 |
+------------------+
1 row in set (0.01 sec)

mysql> select count(firstname) from AddressBook where city = 'Nagpur';
+------------------+
| count(firstname) |
+------------------+
|                0 |
+------------------+
1 row in set (0.00 sec)

mysql> select count(firstname) from AddressBook where city = 'Pune';
+------------------+
| count(firstname) |
+------------------+
|                1 |
+------------------+
1 row in set (0.00 sec)

mysql> select count(firstname) from AddressBook where state='TamilNadu';
+------------------+
| count(firstname) |
+------------------+
|                1 |
+------------------+
1 row in set (0.00 sec)

=======================================================================
-- UC 8 Ability to retrieve entries sorted alphabetically by Person’s name for a given city 
=======================================================================
mysql> insert into AddressBook (firstname, lastname, address,city, state, zip,phoneNumber,email) values
    -> ('Pallavi','Chedge','Lakewood','Nagpur','Maharashtra',600392,8907675123,'pc@gmail.com'),
    -> ('Ashwini','Kapse','BajajNagar','Surat','Gujarat',689765,7895644321,'ashwini@gmail.com');
Query OK, 2 rows affected (0.01 sec)
Records: 2  Duplicates: 0  Warnings: 0

mysql> select * from AddressBook;
+-----------+----------+----------------+---------+-------------+--------+-------------+-------------------+
| firstName | lastName | address        | city    | state       | zip    | phoneNumber | email             |
+-----------+----------+----------------+---------+-------------+--------+-------------+-------------------+
| Rashmi    | Agrawal  | Iriscourt      | Mumbai  | Maharashtra | 804198 |  9805643789 | rashmi@gmail.com  |
| Rahul     | Punewar  | NovaApartment  | Chennai | TamilNadu   | 678907 |  7890065432 | rp@gmail.com      |
| Shashwat  | Agrawal  | DattaApartment | Pune    | Maharashtra | 341009 |  9880565434 | sp@gmail.com      |
| Pallavi   | Chedge   | Lakewood       | Nagpur  | Maharashtra | 600392 |  8907675123 | pc@gmail.com      |
| Ashwini   | Kapse    | BajajNagar     | Surat   | Gujarat     | 689765 |  7895644321 | ashwini@gmail.com |
+-----------+----------+----------------+---------+-------------+--------+-------------+-------------------+
5 rows in set (0.00 sec)

mysql>  select firstname,city from AddressBook order by city;
+-----------+---------+
| firstname | city    |
+-----------+---------+
| Rahul     | Chennai |
| Rashmi    | Mumbai  |
| Pallavi   | Nagpur  |
| Shashwat  | Pune    |
| Ashwini   | Surat   |
+-----------+---------+
5 rows in set (0.01 sec)

=====================================================
-- UC9 Identifying each addressbook with name and type.
======================================================

alter table addressbook add addressbookName varchar(25) not null;
Query OK, 0 rows affected 
Records: 0  Duplicates: 0  Warnings: 0
alter table addressbook add contactType varchar(25) not null;
Query OK, 0 rows affected 
Records: 0  Duplicates: 0  Warnings: 0
mysql>  desc addressbook;
+-----------------+--------------+------+-----+---------+-------+
| Field           | Type         | Null | Key | Default | Extra |
+-----------------+--------------+------+-----+---------+-------+
| firstName       | varchar(50)  | NO   |     | NULL    |       |
| lastName        | varchar(50)  | NO   |     | NULL    |       |
| address         | varchar(100) | NO   |     | NULL    |       |
| city            | varchar(50)  | NO   |     | NULL    |       |
| state           | varchar(50)  | NO   |     | NULL    |       |
| zip             | int          | NO   |     | NULL    |       |
| phoneNumber     | double       | NO   |     | NULL    |       |
| email           | varchar(100) | NO   |     | NULL    |       |
| addressbookName | varchar(25)  | NO   |     | NULL    |       |
| contactType     | varchar(25)  | NO   |     | NULL    |       |
+-----------------+--------------+------+-----+---------+-------+
10 rows in set (0.00 sec)

mysql> update AddressBook set addressbookname='one', contactType='Family' where lastname='Punewar';
Query OK, 1 row affected (0.01 sec)
Rows matched: 1  Changed: 1  Warnings: 0

mysql> update AddressBook set addressbookname='two', contactType='Friends' where lastname='Kapse';
Query OK, 1 row affected (0.00 sec)
Rows matched: 1  Changed: 1  Warnings: 0

mysql> update AddressBook set addressbookname='two', contactType='Profession' where lastname='Agrawal';
Query OK, 2 rows affected (0.01 sec)
Rows matched: 2  Changed: 2  Warnings: 0

mysql> select * from addressbook;
+-----------+----------+----------------+---------+-------------+--------+-------------+-------------------+-----------------+-------------+
| firstName | lastName | address        | city    | state       | zip    | phoneNumber | email             | addressbookName | contactType |
+-----------+----------+----------------+---------+-------------+--------+-------------+-------------------+-----------------+-------------+
| Rashmi    | Agrawal  | Iriscourt      | Mumbai  | Maharashtra | 804198 |  9805643789 | rashmi@gmail.com  | two             | Profession  |
| Rahul     | Punewar  | NovaApartment  | Chennai | TamilNadu   | 678907 |  7890065432 | rp@gmail.com      | one             | Family      |
| Shashwat  | Agrawal  | DattaApartment | Pune    | Maharashtra | 341009 |  9880565434 | sp@gmail.com      | two             | Profession  |
| Pallavi   | Chedge   | Lakewood       | Nagpur  | Maharashtra | 600392 |  8907675123 | pc@gmail.com      |
     |             |
| Ashwini   | Kapse    | BajajNagar     | Surat   | Gujarat     | 689765 |  7895644321 | ashwini@gmail.com | two             | Friends     |
+-----------+----------+----------------+---------+-------------+--------+-------------+-------------------+-----------------+-------------+
5 rows in set (0.00 sec)

mysql> select * from addressbook where contactType='Family';
+-----------+----------+---------------+---------+-----------+--------+-------------+--------------+-----------------+-------------+
| firstName | lastName | address       | city    | state     | zip    | phoneNumber | email        | addressbookName | contactType |
+-----------+----------+---------------+---------+-----------+--------+-------------+--------------+-----------------+-------------+
| Rahul     | Punewar  | NovaApartment | Chennai | TamilNadu | 678907 |  7890065432 | rp@gmail.com | one             | Family      |
+-----------+----------+---------------+---------+-----------+--------+-------------+--------------+-----------------+-------------+
1 row in set (0.00 sec)

mysql> select * from AddressBook where contacttype='Profession';
+-----------+----------+----------------+--------+-------------+--------+-------------+------------------+-----------------+-------------+
| firstName | lastName | address        | city   | state       | zip    | phoneNumber | email            | addressbookName | contactType |
+-----------+----------+----------------+--------+-------------+--------+-------------+------------------+-----------------+-------------+
| Rashmi    | Agrawal  | Iriscourt      | Mumbai | Maharashtra | 804198 |  9805643789 | rashmi@gmail.com | two
   | Profession  |
| Shashwat  | Agrawal  | DattaApartment | Pune   | Maharashtra | 341009 |  9880565434 | sp@gmail.com     | two
   | Profession  |
+-----------+----------+----------------+--------+-------------+--------+-------------+------------------+-----------------+-------------+
2 rows in set (0.00 sec)

mysql> select * from AddressBook where contacttype='Friends';
+-----------+----------+------------+-------+---------+--------+-------------+-------------------+-----------------+-------------+
| firstName | lastName | address    | city  | state   | zip    | phoneNumber | email             | addressbookName | contactType |
+-----------+----------+------------+-------+---------+--------+-------------+-------------------+-----------------+-------------+
| Ashwini   | Kapse    | BajajNagar | Surat | Gujarat | 689765 |  7895644321 | ashwini@gmail.com | two             | Friends     |
+-----------+----------+------------+-------+---------+--------+-------------+-------------------+-----------------+-------------+
1 row in set (0.00 sec)

============================================================
-- UC10 Ability to get a number of contact persons i.e count by type
=============================================================
mysql> select count(firstname) from AddressBook where contactType='Profession';
+------------------+
| count(firstname) |
+------------------+
|                2 |
+------------------+
1 row in set (0.00 sec)

============================================================
-- UC11 Ability to add person to both friend and family
=============================================================
mysql> insert into addressbook (firstName, lastName, address, city, state, zip, phoneNumber, email, addressbookName, contactType)
    -> values('Smarani','Sharma','LaxmiNagar','Mumbai','Maharashtra',603400,8876790543,'smarani@gmail.com','three','Family and Friend');
Query OK, 1 row affected (0.01 sec)

mysql> select * from addressbook;
+-----------+----------+----------------+---------+-------------+--------+-------------+-------------------+-----------------+-------------------+
| firstName | lastName | address        | city    | state       | zip    | phoneNumber | email             | addressbookName | contactType       |
+-----------+----------+----------------+---------+-------------+--------+-------------+-------------------+-----------------+-------------------+
| Rashmi    | Agrawal  | Iriscourt      | Mumbai  | Maharashtra | 804198 |  9805643789 | rashmi@gmail.com  | two             | Profession        |
| Rahul     | Punewar  | NovaApartment  | Chennai | TamilNadu   | 678907 |  7890065432 | rp@gmail.com      | one             | Family            |
| Shashwat  | Agrawal  | DattaApartment | Pune    | Maharashtra | 341009 |  9880565434 | sp@gmail.com      | two             | Profession        |
| Pallavi   | Chedge   | Lakewood       | Nagpur  | Maharashtra | 600392 |  8907675123 | pc@gmail.com      | three           | Family            |
| Ashwini   | Kapse    | BajajNagar     | Surat   | Gujarat     | 689765 |  7895644321 | ashwini@gmail.com | two             | Friends           |
| Smarani   | Sharma   | LaxmiNagar     | Mumbai  | Maharashtra | 603400 |  8876790543 | smarani@gmail.com | three           | Family and Friend |
+-----------+----------+----------------+---------+-------------+--------+-------------+-------------------+-----------------+-------------------+
6 rows in set (0.00 sec)

============================================================
-- UC12 Draw the ER diagram for AddressBook Service Database
=============================================================
mysql> Create table city(
    -> cid int not null auto_increment,
    -> city varchar(50) not null,
    ->  primary key(cid));
Query OK, 0 rows affected (0.02 sec)

mysql> insert into city(city)values('Mumbai'),('Pune'),('Nagpur'),('Chennai'),('Hyderabad'),('Ahmedabad');
Query OK, 6 rows affected (0.01 sec)
Records: 6  Duplicates: 0  Warnings: 0

mysql> select * from city;
+-----+-----------+
| cid | city      |
+-----+-----------+
|   1 | Mumbai    |
|   2 | Pune      |
|   3 | Nagpur    |
|   4 | Chennai   |
|   5 | Hyderabad |
|   6 | Ahmedabad |
+-----+-----------+
6 rows in set (0.00 sec)

mysql> create table personcontact(
    -> id int not null,
    -> firstName varchar(50) not null,
    -> lastName varchar(50) not null,
    -> city int not null,
    -> primary key(id),
    -> foreign key (city) References city(cid));
Query OK, 0 rows affected (0.04 sec)

mysql> insert into personcontact(id, firstName, lastName, city)
    -> values(1, "Radha", "Rathore", 2),
    -> (2, "Shruti", "Patel", 3),
    -> (3, "Vrushabh", "Rai", 1),
    -> (4, "Shilpa", "Sharma", 2);
Query OK, 4 rows affected (0.02 sec)
Records: 4  Duplicates: 0  Warnings: 0

mysql> CREATE TABLE PersonContactType (
    ->     ContactTypeID int NOT NULL,
    ->     firstName varchar(50) not null,
    ->     lastName varchar(50) not null,
    ->     contactType varchar(50) not null,
    ->     ID int,
    ->     PRIMARY KEY (ContactTypeID),
    ->     FOREIGN KEY (ID) REFERENCES addressbook(ID)
    -> );
Query OK, 0 rows affected (0.06 sec)

mysql> INSERT INTO personcontacttype
    -> (`ContactTypeID`,
    -> `firstName`,
    -> `lastName`,
    -> `contactType`,
    -> `ID`)
    -> VALUES
    -> ('1', 'Vidya', 'Pawar', 'Family', '2'),
    -> ('2', 'Shikha', 'Patel', 'Friend', '3'),
    -> ('3', 'Shashwat', 'Chedge', 'Family', '1'),
    -> ('4', 'Mayuri', 'Dhande', 'Profession', '4');
Query OK, 4 rows affected (0.01 sec)
Records: 4  Duplicates: 0  Warnings: 0
