-- AddressBook Service
===========================================================
-- UC1 Ability to create a Address Book Service DataBase
===========================================================

mysql> create database addressbookservice;
Query OK, 1 row affected (0.01 sec)

mysql> show databases;
+--------------------+
| Database           |
+--------------------+
| addressbookservice |
| bridgelabz         |
| employee           |
| information_schema |
| mysql              |
| payroll_service    |
| performance_schema |
| sys                |
+--------------------+
8 rows in set (0.00 sec)

mysql> use addressbookservice;
Database changed

===========================================================
-- UC2  Creating table as AddressBook with attributes
===========================================================
mysql> create table AddressBook ( firstName varchar(50) not null,
    -> lastName varchar(50) not null,
    -> address varchar(100) not null,
    -> city varchar(50) not null,
    -> state varchar(50) not null,
    -> zip int not null,
    -> phoneNumber double not null,
    -> email varchar(100) not null );
Query OK, 0 rows affected (0.03 sec)

mysql> desc AddressBook;
+-------------+--------------+------+-----+---------+-------+
| Field       | Type         | Null | Key | Default | Extra |
+-------------+--------------+------+-----+---------+-------+
| firstName   | varchar(50)  | NO   |     | NULL    |       |
| lastName    | varchar(50)  | NO   |     | NULL    |       |
| address     | varchar(100) | NO   |     | NULL    |       |
| city        | varchar(50)  | NO   |     | NULL    |       |
| state       | varchar(50)  | NO   |     | NULL    |       |
| zip         | int          | NO   |     | NULL    |       |
| phoneNumber | double       | NO   |     | NULL    |       |
| email       | varchar(100) | NO   |     | NULL    |       |
+-------------+--------------+------+-----+---------+-------+
8 rows in set (0.00 sec)

===========================================================
-- UC3  Inserting new contacts to addressbook table
===========================================================
mysql> insert into AddressBook (firstname, lastname, address,city, state, zip,phoneNumber,email) values
    -> ('Pallavi', 'Chedge','Lakewood','Nagpur','Maharashtra', 346789, 8970065743,'pc@gmail.com'),
    -> ('Rashmi', 'Agrawal','Iriscourt','Mumbai','Maharashtra', 804198, 9805643789,'rashmi@gmail.com'),
    -> ('Rahul', 'Punewar','NovaApartment','Chennai','TamilNadu', 678907, 7777856749,'rp@gmail.com'),
    -> ('Shashwat', 'Patel','DattaApartment','Pune','Maharashtra', 341009, 9880565434,'sp@gmail.com');
Query OK, 4 rows affected (0.01 sec)
Records: 4  Duplicates: 0  Warnings: 0

mysql> select * from AddressBook;
+-----------+----------+----------------+---------+-------------+--------+-------------+------------------+
| firstName | lastName | address        | city    | state       | zip    | phoneNumber | email            |
+-----------+----------+----------------+---------+-------------+--------+-------------+------------------+
| Pallavi   | Chedge   | Lakewood       | Nagpur  | Maharashtra | 346789 |  8970065743 | pc@gmail.com     |
| Rashmi    | Agrawal  | Iriscourt      | Mumbai  | Maharashtra | 804198 |  9805643789 | rashmi@gmail.com |
| Rahul     | Punewar  | NovaApartment  | Chennai | TamilNadu   | 678907 |  7777856749 | rp@gmail.com     |
| Shashwat  | Patel    | DattaApartment | Pune    | Maharashtra | 341009 |  9880565434 | sp@gmail.com     |
+-----------+----------+----------------+---------+-------------+--------+-------------+------------------+
4 rows in set (0.00 sec)

===========================================================
-- UC4  Editing existing contact by person's first name
===========================================================
mysql> update AddressBook set  lastName='Agrawal' where firstname='Shashwat';
Query OK, 1 row affected (0.01 sec)
Rows matched: 1  Changed: 1  Warnings: 0

mysql> select * from AddressBook;
+-----------+----------+----------------+---------+-------------+--------+-------------+------------------+
| firstName | lastName | address        | city    | state       | zip    | phoneNumber | email            |
+-----------+----------+----------------+---------+-------------+--------+-------------+------------------+
| Pallavi   | Chedge   | Lakewood       | Nagpur  | Maharashtra | 346789 |  8970065743 | pc@gmail.com     |
| Rashmi    | Agrawal  | Iriscourt      | Mumbai  | Maharashtra | 804198 |  9805643789 | rashmi@gmail.com |
| Rahul     | Punewar  | NovaApartment  | Chennai | TamilNadu   | 678907 |  7777856749 | rp@gmail.com     |
| Shashwat  | Agrawal  | DattaApartment | Pune    | Maharashtra | 341009 |  9880565434 | sp@gmail.com     |
+-----------+----------+----------------+---------+-------------+--------+-------------+------------------+
4 rows in set (0.00 sec)

mysql> update addressbook set phoneNumber=7890065432 where firstname='Rahul';
Query OK, 1 row affected (0.01 sec)
Rows matched: 1  Changed: 1  Warnings: 0

mysql> select * from AddressBook;
+-----------+----------+----------------+---------+-------------+--------+-------------+------------------+
| firstName | lastName | address        | city    | state       | zip    | phoneNumber | email            |
+-----------+----------+----------------+---------+-------------+--------+-------------+------------------+
| Pallavi   | Chedge   | Lakewood       | Nagpur  | Maharashtra | 346789 |  8970065743 | pc@gmail.com     |
| Rashmi    | Agrawal  | Iriscourt      | Mumbai  | Maharashtra | 804198 |  9805643789 | rashmi@gmail.com |
| Rahul     | Punewar  | NovaApartment  | Chennai | TamilNadu   | 678907 |  7890065432 | rp@gmail.com     |
| Shashwat  | Agrawal  | DattaApartment | Pune    | Maharashtra | 341009 |  9880565434 | sp@gmail.com     |
+-----------+----------+----------------+---------+-------------+--------+-------------+------------------+
4 rows in set (0.00 sec)

===========================================================
-- UC5  Delete contact by using person's name
===========================================================
mysql> delete from addressBook where lastname='Chedge';
Query OK, 1 row affected (0.01 sec)

mysql> select * from AddressBook;
+-----------+----------+----------------+---------+-------------+--------+-------------+------------------+
| firstName | lastName | address        | city    | state       | zip    | phoneNumber | email            |
+-----------+----------+----------------+---------+-------------+--------+-------------+------------------+
| Rashmi    | Agrawal  | Iriscourt      | Mumbai  | Maharashtra | 804198 |  9805643789 | rashmi@gmail.com |
| Rahul     | Punewar  | NovaApartment  | Chennai | TamilNadu   | 678907 |  7890065432 | rp@gmail.com     |
| Shashwat  | Agrawal  | DattaApartment | Pune    | Maharashtra | 341009 |  9880565434 | sp@gmail.com     |
+-----------+----------+----------------+---------+-------------+--------+-------------+------------------+
3 rows in set (0.00 sec)